{
  "schema_version": "1.0.0",
  "packet_type": "task",
  "packet_id": "cd8d3ec0-ef18-47f5-bc54-39f0a019d423",
  "trace_id": "e9e52f09-68ab-4a8f-a86b-c23512aeffdd",
  "parent_packet_id": null,
  "created_at": "2026-03-31T05:36:40Z",
  "from_agent": "tower",
  "to_agent": "scribe",
  "task_type": "documentation",
  "priority": "normal",
  "project_id": "control-tower",
  "session_id": "019d12f0-115b-7a20-a4a0-3a8210a841ee",
  "title": "Update repo docs after Inspector work",
  "objective": "Inspect the latest agent result and update the impacted durable repo docs under the configured docs harness.",
  "instructions": [
    "Review the referenced ResultPacket and the changed files before editing docs.",
    "Update existing relevant docs under the configured repo docs roots when possible.",
    "Create a new repo doc only if no suitable existing page covers the change.",
    "Refresh docs indices if you add a new page.",
    "Report doc drift or unresolved ambiguity explicitly instead of inventing facts."
  ],
  "constraints": [
    "Treat repo docs under `docs/` as the durable docs harness.",
    "Treat `.control-tower/docs/state` and `.control-tower/memory` as operational memory, not durable product docs.",
    "Do not modify product source code unless the task packet explicitly requires a small doc-adjacent fix."
  ],
  "inputs": {
    "files": [],
    "artifacts": [],
    "references": [
      ".control-tower/packets/outbox/inspector-pr17-review.result.json"
    ]
  },
  "expected_outputs": [
    "Updated repo docs if needed",
    "A ResultPacket summarizing doc updates, drift, and follow-up gaps"
  ],
  "definition_of_done": [
    "Durable repo docs reflect the changed behavior or workflow",
    "Relevant indices are refreshed if new docs were added",
    "Open doc drift or ambiguity is called out explicitly"
  ],
  "memory_context_refs": [
    ".control-tower/packets/outbox/inspector-pr17-review.result.json"
  ],
  "doc_context_refs": [
    "AGENTS.md",
    "docs/index.md",
    "docs/design-docs/index.md",
    "docs/product-specs/index.md",
    ".control-tower/docs/state/current-status.md"
  ],
  "time_budget": {
    "soft_seconds": 300,
    "hard_seconds": 900
  },
  "requires_review": false,
  "allow_partial": true,
  "metadata": {
    "generated_by": "tower delegate follow-up",
    "seed_result_packet": ".control-tower/packets/outbox/inspector-pr17-review.result.json",
    "seed_result_agent": "inspector"
  }
}
