{
  "schema_version": "1.0.0",
  "packet_type": "task",
  "packet_id": "738719f3-e274-44f8-b000-78c02e16720b",
  "trace_id": "dec1d70c-da71-4f02-b77f-6db1bcf1dc27",
  "parent_packet_id": null,
  "created_at": "2026-03-31T06:02:31Z",
  "from_agent": "tower",
  "to_agent": "git-master",
  "task_type": "git",
  "priority": "high",
  "project_id": "control-tower",
  "session_id": "019d12f0-115b-7a20-a4a0-3a8210a841ee",
  "title": "Check in Codex init model refresh and current operational state",
  "objective": "Create a clean local commit on main that includes the updated tower init Codex model picker defaults, the associated tests, and the current Tower operational artifacts so the working tree is clean afterward.",
  "instructions": [
    "Review the full current working tree and stage all intended tracked and untracked changes for this check-in, including src/, tests/, and current .control-tower operational files.",
    "Create one clean local commit on main with a message that clearly reflects the Codex init model refresh and captured operational state.",
    "Do not push."
  ],
  "constraints": [
    "Do not force-push or rewrite history.",
    "Do not modify product code beyond minimal git hygiene required for the commit."
  ],
  "inputs": {
    "files": [
      "src/control_tower/config_ui.py",
      "tests/test_bootstrap.py",
      ".control-tower/docs/state/decisions.md",
      ".control-tower/memory/l0.md",
      ".control-tower/memory/l1.md"
    ],
    "artifacts": [],
    "references": []
  },
  "expected_outputs": [
    "ResultPacket with commit hash, commit message, included scope, and final working tree status."
  ],
  "definition_of_done": [
    "A local commit exists on main.",
    "The working tree is clean after the commit."
  ],
  "memory_context_refs": [],
  "doc_context_refs": [],
  "time_budget": {
    "soft_seconds": 900,
    "hard_seconds": 3600
  },
  "requires_review": true,
  "allow_partial": false,
  "metadata": {}
}
