{
  "schema_version": "1.0.0",
  "packet_type": "task",
  "packet_id": "6a40bbc4-e77b-4a86-8c3b-e187c230c1d5",
  "trace_id": "fc82f8b1-f29f-4261-bf6b-78cec28b023c",
  "parent_packet_id": null,
  "created_at": "2026-03-22T00:37:16Z",
  "from_agent": "tower",
  "to_agent": "scribe",
  "task_type": "documentation",
  "priority": "normal",
  "project_id": "control-tower",
  "session_id": "019d12f0-115b-7a20-a4a0-3a8210a841ee",
  "title": "Update repo docs after Git-Master work",
  "objective": "Inspect the latest agent result and update the impacted durable repo docs under the configured docs harness.",
  "instructions": [
    "Review the referenced ResultPacket and the changed files before editing docs.",
    "Update existing relevant docs under the configured repo docs roots when possible.",
    "Create a new repo doc only if no suitable existing page covers the change.",
    "Refresh docs indices if you add a new page.",
    "Report doc drift or unresolved ambiguity explicitly instead of inventing facts."
  ],
  "constraints": [
    "Treat repo docs under `docs/` as the durable docs harness.",
    "Treat `.control-tower/docs/state` and `.control-tower/memory` as operational memory, not durable product docs.",
    "Do not modify product source code unless the task packet explicitly requires a small doc-adjacent fix."
  ],
  "inputs": {
    "files": [
      "AGENTS.md",
      "docs/index.md",
      "docs/design-docs/index.md",
      "docs/product-specs/index.md",
      "docs/runbooks/README.md",
      ".control-tower/agents/",
      " .control-tower/docs/",
      " .control-tower/memory/l0.md",
      " .control-tower/memory/l1.md",
      " .control-tower/memory/l2/README.md",
      " .control-tower/packets/inbox/README.md",
      " .control-tower/packets/outbox/README.md",
      " .control-tower/schemas/",
      " .control-tower/state/agent-registry.json",
      " .control-tower/state/decision-graph/edges.json",
      " .control-tower/state/decision-graph/indexes.json",
      " .control-tower/state/decision-graph/nodes.json",
      " .control-tower/state/project.json",
      " .control-tower/state/runtime.json",
      " .control-tower/state/session-index.json",
      " .control-tower/state/task-ledger.json"
    ],
    "artifacts": [],
    "references": [
      ".control-tower/packets/outbox/git-master-checkin-rollout.result.json"
    ]
  },
  "expected_outputs": [
    "Updated repo docs if needed",
    "A ResultPacket summarizing doc updates, drift, and follow-up gaps"
  ],
  "definition_of_done": [
    "Durable repo docs reflect the changed behavior or workflow",
    "Relevant indices are refreshed if new docs were added",
    "Open doc drift or ambiguity is called out explicitly"
  ],
  "memory_context_refs": [
    ".control-tower/packets/outbox/git-master-checkin-rollout.result.json"
  ],
  "doc_context_refs": [
    "AGENTS.md",
    "docs/index.md",
    "docs/design-docs/index.md",
    "docs/product-specs/index.md",
    ".control-tower/docs/state/current-status.md"
  ],
  "time_budget": {
    "soft_seconds": 300,
    "hard_seconds": 900
  },
  "requires_review": false,
  "allow_partial": true,
  "metadata": {
    "generated_by": "tower delegate follow-up",
    "seed_result_packet": ".control-tower/packets/outbox/git-master-checkin-rollout.result.json",
    "seed_result_agent": "git-master"
  }
}
