{
  "schema_version": "1.0.0",
  "packet_type": "task",
  "packet_id": "f8dc6803-1de6-4d8b-87fd-68d6a330c301",
  "trace_id": "d33890b0-1684-45b7-aa05-9797079c0db7",
  "parent_packet_id": null,
  "created_at": "2026-03-31T05:53:37Z",
  "from_agent": "tower",
  "to_agent": "scout",
  "task_type": "research",
  "priority": "high",
  "project_id": "control-tower",
  "session_id": "019d12f0-115b-7a20-a4a0-3a8210a841ee",
  "title": "Recommend current Codex init model defaults",
  "objective": "Determine the best current default shortlist of Codex model options to show during tower init, replacing the older hardcoded options with up-to-date choices grounded in current official OpenAI/Codex reality.",
  "instructions": [
    "Inspect the current repository code to find where tower init exposes model choices or defaults.",
    "Verify current Codex-relevant model options from primary official OpenAI/Codex sources or current local Codex CLI behavior, and recommend exactly five default options in priority order for tower init.",
    "Call out any naming or UX caveats, especially around 5.4, mini, nano, and legacy aliases."
  ],
  "constraints": [
    "Do not modify files.",
    "Ground recommendations in primary current sources, not stale memory."
  ],
  "inputs": {
    "files": [
      "src/control_tower/config_ui.py",
      "src/control_tower/templates/project/state/project.json"
    ],
    "artifacts": [],
    "references": []
  },
  "expected_outputs": [
    "ResultPacket with exactly five recommended default Codex model options, source basis, and any implementation notes."
  ],
  "definition_of_done": [
    "The packet recommends a concrete five-option default list for tower init.",
    "The recommendation is backed by current primary-source evidence or current CLI evidence."
  ],
  "memory_context_refs": [],
  "doc_context_refs": [],
  "time_budget": {
    "soft_seconds": 900,
    "hard_seconds": 3600
  },
  "requires_review": true,
  "allow_partial": false,
  "metadata": {}
}
