{
  "schema_version": "1.0.0",
  "packet_type": "task",
  "packet_id": "3f9ccdd5-a02c-4627-bc27-92b4ca448559",
  "trace_id": "357d2416-19a1-4a84-bd04-9b625be0ea34",
  "parent_packet_id": null,
  "created_at": "2026-03-31T05:58:56Z",
  "from_agent": "tower",
  "to_agent": "inspector",
  "task_type": "review",
  "priority": "high",
  "project_id": "control-tower",
  "session_id": "019d12f0-115b-7a20-a4a0-3a8210a841ee",
  "title": "Verify Codex init model default refresh",
  "objective": "Review the current uncommitted changes that refresh the tower init Codex model shortlist and confirm there are no regressions in the picker behavior or targeted tests.",
  "instructions": [
    "Review the current diff in src/control_tower/config_ui.py and tests/test_bootstrap.py for correctness, regressions, and missing tests.",
    "Run focused verification for the updated picker tests and adjacent init-interactive tests.",
    "Call out any remaining issues, including whether the Enter/default behavior should be considered a follow-up or a blocker."
  ],
  "constraints": [
    "Do not modify files.",
    "Ground findings in the actual current diff and test runs."
  ],
  "inputs": {
    "files": [
      "src/control_tower/config_ui.py",
      "tests/test_bootstrap.py"
    ],
    "artifacts": [],
    "references": []
  },
  "expected_outputs": [
    "ResultPacket with findings, residual risks, and verification status."
  ],
  "definition_of_done": [
    "The refreshed Codex model picker diff is reviewed.",
    "Targeted verification is complete with an explicit merge/readiness assessment."
  ],
  "memory_context_refs": [],
  "doc_context_refs": [],
  "time_budget": {
    "soft_seconds": 900,
    "hard_seconds": 3600
  },
  "requires_review": true,
  "allow_partial": false,
  "metadata": {}
}
