{
  "schema_version": "1.0.0",
  "packet_type": "task",
  "packet_id": "e0827733-9e3e-4da6-9013-9005bc9ca13c",
  "trace_id": "4256d614-ae07-4dc1-8c71-09bbad773aba",
  "parent_packet_id": null,
  "created_at": "2026-03-31T05:53:37Z",
  "from_agent": "tower",
  "to_agent": "git-master",
  "task_type": "git",
  "priority": "high",
  "project_id": "control-tower",
  "session_id": "019d12f0-115b-7a20-a4a0-3a8210a841ee",
  "title": "Sync local main after PR 17 merge",
  "objective": "Update the local main branch to match origin/main after PR #17 was merged, while preserving and not committing transient Tower operational artifacts in the working tree.",
  "instructions": [
    "Inspect the current main worktree status and identify transient .control-tower operational changes and packet artifacts that should not be committed.",
    "Update local main from origin/main so the worktree reflects the merged PR content.",
    "Preserve local transient operational artifacts; do not commit, push, or discard them unless needed temporarily for pull hygiene, and restore them afterward if stashed."
  ],
  "constraints": [
    "Do not create commits, push, force-push, or rewrite published history.",
    "Do not modify product code except what is required by the pull/update operation itself."
  ],
  "inputs": {
    "files": [
      "AGENTS.md",
      ".control-tower/memory/l0.md",
      ".control-tower/memory/l1.md"
    ],
    "artifacts": [],
    "references": []
  },
  "expected_outputs": [
    "ResultPacket with branch status, pulled commit range, and any temporary stash/use of transient artifacts."
  ],
  "definition_of_done": [
    "Local main is updated to origin/main.",
    "Transient Tower operational files remain uncommitted after the sync."
  ],
  "memory_context_refs": [],
  "doc_context_refs": [],
  "time_budget": {
    "soft_seconds": 900,
    "hard_seconds": 3600
  },
  "requires_review": true,
  "allow_partial": false,
  "metadata": {}
}
